{
  "schemaVersion": 1,
  "source": "DESIGN.md v1.1 Appendix H (city list, coordinates and date rule); zones are IANA tzdb zones and countries ISO 3166-1 alpha-2; Ramadan bounds are the ADR-016 tabular calendar (DESIGN.md §15 D30)",
  "dateSet": {
    "seasons": ["MARCH_EQUINOX", "JUNE_SOLSTICE", "SEPTEMBER_EQUINOX", "DECEMBER_SOLSTICE"],
    "dayOfMonth": 15,
    "dstWindowDays": 7,
    "ramadan": [
      { "hijriYear": 1447, "firstDay": "2026-02-17", "lastDay": "2026-03-18", "confidence": "EXPECTED", "source": "ADR-016 tabular (Kuwaiti) calendar, astronomical epoch JDN 1948439" },
      { "hijriYear": 1448, "firstDay": "2027-02-07", "lastDay": "2027-03-08", "confidence": "EXPECTED", "source": "ADR-016 tabular (Kuwaiti) calendar, astronomical epoch JDN 1948439" },
      { "hijriYear": 1449, "firstDay": "2028-01-27", "lastDay": "2028-02-25", "confidence": "EXPECTED", "source": "ADR-016 tabular (Kuwaiti) calendar, astronomical epoch JDN 1948439" }
    ]
  },
  "cities": [
    { "cityId": "dubai", "name": "Dubai", "latitudeDeg": 25.2, "longitudeDeg": 55.27, "zoneId": "Asia/Dubai", "country": "AE" },
    { "cityId": "abu_dhabi", "name": "Abu Dhabi", "latitudeDeg": 24.45, "longitudeDeg": 54.38, "zoneId": "Asia/Dubai", "country": "AE" },
    { "cityId": "makkah", "name": "Makkah", "latitudeDeg": 21.42, "longitudeDeg": 39.83, "zoneId": "Asia/Riyadh", "country": "SA" },
    { "cityId": "riyadh", "name": "Riyadh", "latitudeDeg": 24.71, "longitudeDeg": 46.68, "zoneId": "Asia/Riyadh", "country": "SA" },
    { "cityId": "jeddah", "name": "Jeddah", "latitudeDeg": 21.49, "longitudeDeg": 39.19, "zoneId": "Asia/Riyadh", "country": "SA" },
    { "cityId": "muscat", "name": "Muscat", "latitudeDeg": 23.59, "longitudeDeg": 58.38, "zoneId": "Asia/Muscat", "country": "OM" },
    { "cityId": "doha", "name": "Doha", "latitudeDeg": 25.29, "longitudeDeg": 51.53, "zoneId": "Asia/Qatar", "country": "QA" },
    { "cityId": "kuwait_city", "name": "Kuwait City", "latitudeDeg": 29.38, "longitudeDeg": 47.99, "zoneId": "Asia/Kuwait", "country": "KW" },
    { "cityId": "amman", "name": "Amman", "latitudeDeg": 31.95, "longitudeDeg": 35.93, "zoneId": "Asia/Amman", "country": "JO" },
    { "cityId": "istanbul", "name": "Istanbul", "latitudeDeg": 41.01, "longitudeDeg": 28.98, "zoneId": "Europe/Istanbul", "country": "TR" },
    { "cityId": "cairo", "name": "Cairo", "latitudeDeg": 30.04, "longitudeDeg": 31.24, "zoneId": "Africa/Cairo", "country": "EG" },
    { "cityId": "alexandria", "name": "Alexandria", "latitudeDeg": 31.2, "longitudeDeg": 29.92, "zoneId": "Africa/Cairo", "country": "EG" },
    { "cityId": "aswan", "name": "Aswan", "latitudeDeg": 24.09, "longitudeDeg": 32.9, "zoneId": "Africa/Cairo", "country": "EG" },
    { "cityId": "casablanca", "name": "Casablanca", "latitudeDeg": 33.57, "longitudeDeg": -7.59, "zoneId": "Africa/Casablanca", "country": "MA" },
    { "cityId": "tunis", "name": "Tunis", "latitudeDeg": 36.81, "longitudeDeg": 10.17, "zoneId": "Africa/Tunis", "country": "TN" },
    { "cityId": "algiers", "name": "Algiers", "latitudeDeg": 36.75, "longitudeDeg": 3.06, "zoneId": "Africa/Algiers", "country": "DZ" },
    { "cityId": "london", "name": "London", "latitudeDeg": 51.51, "longitudeDeg": -0.13, "zoneId": "Europe/London", "country": "GB" },
    { "cityId": "paris", "name": "Paris", "latitudeDeg": 48.86, "longitudeDeg": 2.35, "zoneId": "Europe/Paris", "country": "FR" },
    { "cityId": "berlin", "name": "Berlin", "latitudeDeg": 52.52, "longitudeDeg": 13.41, "zoneId": "Europe/Berlin", "country": "DE" },
    { "cityId": "oslo", "name": "Oslo", "latitudeDeg": 59.91, "longitudeDeg": 10.75, "zoneId": "Europe/Oslo", "country": "NO" },
    { "cityId": "stockholm", "name": "Stockholm", "latitudeDeg": 59.33, "longitudeDeg": 18.07, "zoneId": "Europe/Stockholm", "country": "SE" },
    { "cityId": "reykjavik", "name": "Reykjavik", "latitudeDeg": 64.15, "longitudeDeg": -21.94, "zoneId": "Atlantic/Reykjavik", "country": "IS" },
    { "cityId": "tromso", "name": "Tromsø", "latitudeDeg": 69.65, "longitudeDeg": 18.96, "zoneId": "Europe/Oslo", "country": "NO" },
    { "cityId": "longyearbyen", "name": "Longyearbyen", "latitudeDeg": 78.22, "longitudeDeg": 15.63, "zoneId": "Arctic/Longyearbyen", "country": "SJ" },
    { "cityId": "karachi", "name": "Karachi", "latitudeDeg": 24.86, "longitudeDeg": 67.01, "zoneId": "Asia/Karachi", "country": "PK" },
    { "cityId": "delhi", "name": "Delhi", "latitudeDeg": 28.61, "longitudeDeg": 77.21, "zoneId": "Asia/Kolkata", "country": "IN" },
    { "cityId": "dhaka", "name": "Dhaka", "latitudeDeg": 23.81, "longitudeDeg": 90.41, "zoneId": "Asia/Dhaka", "country": "BD" },
    { "cityId": "kuala_lumpur", "name": "Kuala Lumpur", "latitudeDeg": 3.14, "longitudeDeg": 101.69, "zoneId": "Asia/Kuala_Lumpur", "country": "MY" },
    { "cityId": "jakarta", "name": "Jakarta", "latitudeDeg": -6.21, "longitudeDeg": 106.85, "zoneId": "Asia/Jakarta", "country": "ID" },
    { "cityId": "tokyo", "name": "Tokyo", "latitudeDeg": 35.68, "longitudeDeg": 139.69, "zoneId": "Asia/Tokyo", "country": "JP" },
    { "cityId": "tashkent", "name": "Tashkent", "latitudeDeg": 41.3, "longitudeDeg": 69.24, "zoneId": "Asia/Tashkent", "country": "UZ" },
    { "cityId": "kabul", "name": "Kabul", "latitudeDeg": 34.53, "longitudeDeg": 69.17, "zoneId": "Asia/Kabul", "country": "AF" },
    { "cityId": "new_york", "name": "New York", "latitudeDeg": 40.71, "longitudeDeg": -74.01, "zoneId": "America/New_York", "country": "US" },
    { "cityId": "toronto", "name": "Toronto", "latitudeDeg": 43.65, "longitudeDeg": -79.38, "zoneId": "America/Toronto", "country": "CA" },
    { "cityId": "chicago", "name": "Chicago", "latitudeDeg": 41.88, "longitudeDeg": -87.63, "zoneId": "America/Chicago", "country": "US" },
    { "cityId": "vancouver", "name": "Vancouver", "latitudeDeg": 49.28, "longitudeDeg": -123.12, "zoneId": "America/Vancouver", "country": "CA" },
    { "cityId": "anchorage", "name": "Anchorage", "latitudeDeg": 61.22, "longitudeDeg": -149.9, "zoneId": "America/Anchorage", "country": "US" },
    { "cityId": "utqiagvik", "name": "Utqiaġvik", "latitudeDeg": 71.29, "longitudeDeg": -156.79, "zoneId": "America/Anchorage", "country": "US" },
    { "cityId": "mexico_city", "name": "Mexico City", "latitudeDeg": 19.43, "longitudeDeg": -99.13, "zoneId": "America/Mexico_City", "country": "MX" },
    { "cityId": "sao_paulo", "name": "São Paulo", "latitudeDeg": -23.55, "longitudeDeg": -46.63, "zoneId": "America/Sao_Paulo", "country": "BR" },
    { "cityId": "cape_town", "name": "Cape Town", "latitudeDeg": -33.92, "longitudeDeg": 18.42, "zoneId": "Africa/Johannesburg", "country": "ZA" },
    { "cityId": "johannesburg", "name": "Johannesburg", "latitudeDeg": -26.2, "longitudeDeg": 28.05, "zoneId": "Africa/Johannesburg", "country": "ZA" },
    { "cityId": "sydney", "name": "Sydney", "latitudeDeg": -33.87, "longitudeDeg": 151.21, "zoneId": "Australia/Sydney", "country": "AU" },
    { "cityId": "auckland", "name": "Auckland", "latitudeDeg": -36.85, "longitudeDeg": 174.76, "zoneId": "Pacific/Auckland", "country": "NZ" },
    { "cityId": "ushuaia", "name": "Ushuaia", "latitudeDeg": -54.8, "longitudeDeg": -68.3, "zoneId": "America/Argentina/Ushuaia", "country": "AR" },
    { "cityId": "quito", "name": "Quito", "latitudeDeg": -0.18, "longitudeDeg": -78.47, "zoneId": "America/Guayaquil", "country": "EC" },
    { "cityId": "kiritimati", "name": "Kiritimati", "latitudeDeg": 1.87, "longitudeDeg": -157.43, "zoneId": "Pacific/Kiritimati", "country": "KI" },
    { "cityId": "suva", "name": "Suva", "latitudeDeg": -18.14, "longitudeDeg": 178.44, "zoneId": "Pacific/Fiji", "country": "FJ" },
    { "cityId": "nairobi", "name": "Nairobi", "latitudeDeg": -1.29, "longitudeDeg": 36.82, "zoneId": "Africa/Nairobi", "country": "KE" }
  ]
}
